{
  "format": "ganksoft.content",
  "schemaVersion": "2.0",
  "packageId": "ganksoft-fresh-test-20261016-memory-v1",
  "namespace": "ganksoft-fresh-test-20261016-memory",
  "archives": [],
  "items": [
    {
      "key": "fresh-m-001",
      "kind": "memory",
      "subject": "memory-default",
      "title": "复盘记忆测试01",
      "cue": "基期量如何计算？",
      "content": "基期量=现期量÷(1+增长率)。",
      "knowledgeRefs": []
    },
    {
      "key": "fresh-m-002",
      "kind": "memory",
      "subject": "memory-default",
      "title": "复盘记忆测试02",
      "cue": "已知基期量和增长率，增长量如何计算？",
      "content": "增长量=基期量×增长率。",
      "knowledgeRefs": []
    },
    {
      "key": "fresh-m-003",
      "kind": "memory",
      "subject": "memory-default",
      "title": "复盘记忆测试03",
      "cue": "比重如何计算？",
      "content": "比重=部分量÷整体量。",
      "knowledgeRefs": []
    },
    {
      "key": "fresh-m-004",
      "kind": "memory",
      "subject": "memory-default",
      "title": "复盘记忆测试04",
      "cue": "相向出发的相遇时间如何计算？",
      "content": "相遇时间=两地距离÷速度和。",
      "knowledgeRefs": []
    },
    {
      "key": "fresh-m-005",
      "kind": "memory",
      "subject": "memory-default",
      "title": "复盘记忆测试05",
      "cue": "两集合的容斥关系是什么？",
      "content": "并集数量=集合A数量+集合B数量−交集数量。",
      "knowledgeRefs": []
    },
    {
      "key": "fresh-m-006",
      "kind": "memory",
      "subject": "memory-default",
      "title": "复盘记忆测试06",
      "cue": "“只有P，才Q”对应什么推出关系？",
      "content": "Q推出P，P是Q的必要条件。",
      "knowledgeRefs": []
    }
  ]
}